{"$schema":"https://json-schema.org/draft/2020-12/schema","$id":"urn:hwm:schema:knowledge-delta:v1","title":"HWM PR knowledge delta v1","type":"object","additionalProperties":false,"required":["schema","task_id","goal","verified_facts","decisions","rejected_alternatives","changed_components","tests","evidence","followups","unresolved"],"properties":{"schema":{"const":"hwm-knowledge-delta/v1"},"task_id":{"type":"integer","minimum":1},"goal":{"type":"string","minLength":1,"maxLength":4000},"verified_facts":{"type":"array","items":{"type":"object","additionalProperties":false,"required":["statement","provenance"],"properties":{"statement":{"type":"string","minLength":1,"maxLength":4000},"provenance":{"type":"array","minItems":1,"items":{"type":"object","additionalProperties":false,"required":["kind","reference"],"properties":{"kind":{"type":"string","enum":["commit","ci_run","evidence_manifest","issue","pull_request","public_ref"]},"reference":{"type":"string","minLength":1,"maxLength":1000},"repo":{"type":"string","pattern":"^[A-Za-z0-9_.-]+/[A-Za-z0-9_.-]+$"},"sha":{"type":"string","pattern":"^[0-9a-f]{40}$"}},"dependentRequired":{"sha":["repo"]}}}}}},"decisions":{"type":"array","items":{"type":"object","additionalProperties":false,"required":["decision","rationale"],"properties":{"decision":{"type":"string","minLength":1,"maxLength":4000},"rationale":{"type":"string","minLength":1,"maxLength":4000}}}},"rejected_alternatives":{"type":"array","items":{"type":"object","additionalProperties":false,"required":["alternative","reason"],"properties":{"alternative":{"type":"string","minLength":1,"maxLength":4000},"reason":{"type":"string","minLength":1,"maxLength":4000}}}},"changed_components":{"type":"array","items":{"type":"string","minLength":1,"maxLength":500},"uniqueItems":true},"tests":{"type":"array","items":{"type":"object","additionalProperties":false,"required":["name","status"],"properties":{"name":{"type":"string","minLength":1,"maxLength":500},"status":{"type":"string","enum":["pass","fail","not_run"]},"reference":{"type":"string","minLength":1,"maxLength":1000}}}},"evidence":{"type":"array","items":{"type":"object","additionalProperties":false,"required":["kind","reference"],"properties":{"kind":{"type":"string","enum":["commit","ci_run","evidence_manifest","issue","pull_request","public_ref"]},"reference":{"type":"string","minLength":1,"maxLength":1000},"repo":{"type":"string","pattern":"^[A-Za-z0-9_.-]+/[A-Za-z0-9_.-]+$"},"sha":{"type":"string","pattern":"^[0-9a-f]{40}$"}},"dependentRequired":{"sha":["repo"]}}},"followups":{"type":"array","items":{"type":"string","minLength":1,"maxLength":4000}},"unresolved":{"type":"array","items":{"type":"string","minLength":1,"maxLength":4000}}}}
