{"schema":"hwm-knowledge-delta/v1","task_id":40,"goal":"Make generated historical-ledger pull-request required checks automation-compatible while preserving ordinary source/governance PR CI, exact-head validation, publisher trust boundaries, and the active hwm-context ruleset.","verified_facts":[{"statement":"I08-0040 was claimed from protected hwm-control main 292439643646b8487b2062add8ef51ee2d0409df on sole ownership branch agent/infra-0040-ledger-pr-checks after completed dependency Issue #37; Issue #38 remained claimed on its preserved branch at bd62c9afe481a925011757c4c9dec7d582c0ac35.","provenance":[{"kind":"commit","reference":"protected hwm-control main at I08-0040 claim","repo":"Dsamofalov/hwm-control","sha":"292439643646b8487b2062add8ef51ee2d0409df"},{"kind":"issue","reference":"Dsamofalov/hwm-control#40 claim record comment 5298182405"},{"kind":"commit","reference":"preserved Issue #38 ownership branch head","repo":"Dsamofalov/hwm-control","sha":"bd62c9afe481a925011757c4c9dec7d582c0ac35"}]},{"statement":"hwm-context remediation PR #9 added pull_request paths-ignore for exactly claims/claims.jsonl and claims/conflicts.json plus deterministic tests; ordinary PR bootstrap 31841134177 and post-merge push bootstrap 31841181537 succeeded, producing protected hwm-context main d4c707ad36e955186f05caa2081949d04db798f5.","provenance":[{"kind":"pull_request","reference":"Dsamofalov/hwm-context#9"},{"kind":"ci_run","reference":"Repository Bootstrap CI 31841134177"},{"kind":"ci_run","reference":"Repository Bootstrap CI 31841181537"},{"kind":"commit","reference":"protected hwm-context main after I08-P2 remediation","repo":"Dsamofalov/hwm-context","sha":"d4c707ad36e955186f05caa2081949d04db798f5"}]},{"statement":"Ruleset 20817497 remained active with strict required check bootstrap, protected PR flow, review-thread resolution, and no bypass actor before and after the remediation merge.","provenance":[{"kind":"public_ref","reference":"Dsamofalov/hwm-context ruleset 20817497 read before/after remediation"}]},{"statement":"Disposable ordinary PR #10 produced automatic pull_request Repository Bootstrap CI 31841262779 with bootstrap success, then closed unmerged and cleanup 31841354592 deleted its scoped branch.","provenance":[{"kind":"pull_request","reference":"Dsamofalov/hwm-context#10"},{"kind":"ci_run","reference":"Repository Bootstrap CI 31841262779"},{"kind":"ci_run","reference":"Historical Ledger Publisher cleanup 31841354592"}]},{"statement":"Trusted sandbox publication I08-0040-sandbox-generated-v1 created generated PR #11 at exact head b821a551f33206f2a6b7cb999bb5ee1b67555baf with only the two canonical ledger paths; zero automatic pull_request Repository Bootstrap runs existed for that head, while explicit workflow_dispatch 31841423239 produced bootstrap success after exact GITHUB_SHA and checkout verification.","provenance":[{"kind":"pull_request","reference":"Dsamofalov/hwm-context#11"},{"kind":"commit","reference":"generated sandbox candidate","repo":"Dsamofalov/hwm-context","sha":"b821a551f33206f2a6b7cb999bb5ee1b67555baf"},{"kind":"ci_run","reference":"Repository Bootstrap CI workflow_dispatch 31841423239"},{"kind":"issue","reference":"Dsamofalov/hwm-context#2 request/result for I08-0040-sandbox-generated-v1"}]},{"statement":"Disposable exact-two-path pre-dispatch PR #12 had zero workflow runs and remained protected-merge blocked while required bootstrap was absent; it was closed unmerged and cleanup 31841561164 succeeded.","provenance":[{"kind":"pull_request","reference":"Dsamofalov/hwm-context#12"},{"kind":"ci_run","reference":"Historical Ledger Publisher cleanup 31841561164"}]},{"statement":"Disposable mixed-path PR #13 changed both canonical ledger outputs plus an additional nonignored path and therefore produced automatic pull_request Repository Bootstrap CI 31841597722 with bootstrap success; cleanup 31841621365 succeeded after unmerged close.","provenance":[{"kind":"pull_request","reference":"Dsamofalov/hwm-context#13"},{"kind":"ci_run","reference":"Repository Bootstrap CI 31841597722"},{"kind":"ci_run","reference":"Historical Ledger Publisher cleanup 31841621365"}]},{"statement":"Official GitHub documentation confirms pull requests created or updated by a workflow using repository GITHUB_TOKEN create opened/synchronize/reopened pull_request runs in an approval-required state, while workflow_dispatch always creates runs.","provenance":[{"kind":"public_ref","reference":"GitHub Docs: automatic token authentication and workflow-triggering behavior, rechecked during I08-0040"}]}],"decisions":[{"decision":"Use exact pull_request paths-ignore entries only for claims/claims.jsonl and claims/conflicts.json.","rationale":"This suppresses the approval-required automatic PR run only for canonical generated-only publication while any additional or wrong path still triggers ordinary PR CI."},{"decision":"Preserve push main, workflow_dispatch, exact-head dispatch verification, and required job/check name bootstrap unchanged.","rationale":"Generated candidates can satisfy the existing strict required check through exact-head explicit dispatch without changing governance semantics."},{"decision":"Keep the historical-ledger publisher and its request/result schemas unchanged.","rationale":"The defect is in PR-trigger compatibility, not publisher serialization, repository/path authority, CAS, idempotency, credential scope, or candidate execution boundaries."},{"decision":"Use disposable unmerged live PRs for ordinary, generated-only, pre-dispatch, and mixed-path acceptance.","rationale":"This proves trigger and required-check behavior without materializing Issue #38 claims or mutating protected main with sandbox ledger bytes."}],"rejected_alternatives":[{"alternative":"Ignore claims/** or another broad claims filter.","reason":"A broad filter could hide additional or wrong-path changes from ordinary pull_request CI."},{"alternative":"Require owner approval of GITHUB_TOKEN-created automatic pull_request workflow runs.","reason":"That is a repeatable manual dependency and does not remediate automation compatibility."},{"alternative":"Introduce a PAT, deploy key, GitHub App credential, publisher approval/merge authority, or direct main write.","reason":"The existing repository-scoped GITHUB_TOKEN and protected PR model are sufficient once the generated-only automatic trigger is excluded exactly."},{"alternative":"Expand historical-ledger request/result schemas or hwm-publish-request/bootstrap-v1.","reason":"No serialization incompatibility was observed; changing those contracts would broaden scope and trust unnecessarily."}],"changed_components":["Dsamofalov/hwm-context:.github/workflows/repository-bootstrap-ci.yml","Dsamofalov/hwm-context:publisher/test_repository_bootstrap_ci.py","knowledge-deltas/I08-0040.json","BUILD_STATUS.json"],"tests":[{"name":"remediation ordinary pull_request bootstrap","status":"pass","reference":"hwm-context PR #9 run 31841134177"},{"name":"remediation post-merge push bootstrap","status":"pass","reference":"hwm-context main d4c707ad36e955186f05caa2081949d04db798f5 run 31841181537"},{"name":"ordinary disposable PR automatic bootstrap","status":"pass","reference":"PR #10 run 31841262779; cleanup 31841354592"},{"name":"generated-only automatic PR-run suppression plus exact-head dispatch","status":"pass","reference":"PR #11 head b821a551f33206f2a6b7cb999bb5ee1b67555baf; pull_request run count 0; workflow_dispatch 31841423239 success"},{"name":"pre-dispatch required-check protection","status":"pass","reference":"PR #12 had zero workflow runs and mergeable_state blocked before close; cleanup 31841561164"},{"name":"mixed-path automatic CI fail-open safety","status":"pass","reference":"PR #13 automatic pull_request run 31841597722 success; cleanup 31841621365"},{"name":"deterministic exact-filter and publisher-boundary unit tests","status":"pass","reference":"publisher/test_repository_bootstrap_ci.py executed in PR #9 and post-merge bootstrap"}],"evidence":[{"kind":"issue","reference":"Dsamofalov/hwm-control#40"},{"kind":"pull_request","reference":"Dsamofalov/hwm-context#9"},{"kind":"pull_request","reference":"Dsamofalov/hwm-context#10"},{"kind":"pull_request","reference":"Dsamofalov/hwm-context#11"},{"kind":"pull_request","reference":"Dsamofalov/hwm-context#12"},{"kind":"pull_request","reference":"Dsamofalov/hwm-context#13"},{"kind":"ci_run","reference":"Repository Bootstrap CI 31841134177"},{"kind":"ci_run","reference":"Repository Bootstrap CI 31841181537"},{"kind":"ci_run","reference":"Repository Bootstrap CI 31841423239"},{"kind":"ci_run","reference":"Repository Bootstrap CI 31841597722"}],"followups":["After I08-0040 is fully completed, recover and continue Issue #38 only in a separate dialogue from its preserved ownership state; do not continue the importer in I08-0040."],"unresolved":["Final read-only generated-PR merge-eligibility recheck after exact-head bootstrap is still in progress and must be resolved before I08-0040 completion."]}
