{
  "schema": "hwm-knowledge-delta/v1",
  "task_id": 86,
  "goal": "Define the forward-only architecture and typed fail-closed contracts for a separate repository-local controlled protected-path installer without implementing it or widening the ordinary source publisher.",
  "verified_facts": [
    {
      "statement": "I10-0086 started from protected hwm-control/main bc8a05f6c728d15e32048e5737d9703cd768b731, hwm-lab/main e37ea628d9c793d5e87bc8b903a9b85b4371991c, hwm-context/main d651f40d0bb3a3ef0e52fca95e5400ed3db3d772, and hwm_predictor/main 8fd669336b36064e842252d69fb4016cc526a9d4.",
      "provenance": [
        {"kind": "commit", "reference": "protected P0A base", "repo": "Dsamofalov/hwm-control", "sha": "bc8a05f6c728d15e32048e5737d9703cd768b731"},
        {"kind": "commit", "reference": "protected lab checkpoint", "repo": "Dsamofalov/hwm-lab", "sha": "e37ea628d9c793d5e87bc8b903a9b85b4371991c"},
        {"kind": "commit", "reference": "protected context checkpoint", "repo": "Dsamofalov/hwm-context", "sha": "d651f40d0bb3a3ef0e52fca95e5400ed3db3d772"},
        {"kind": "commit", "reference": "protected product checkpoint", "repo": "Dsamofalov/hwm_predictor", "sha": "8fd669336b36064e842252d69fb4016cc526a9d4"}
      ]
    },
    {
      "statement": "Issue #73 is open + claimed and paused on #85; its control recovery branch is agent/infra-0073-graphify-builder-control at 994730d637d4e4c7c4eb492b22c49993e971d1e4 and its hwm-lab recovery branch is agent/infra-0004-i10-p1-0073-graphify-builder at 1595b39b4684143bc34cb5d157eabf1ad4d86c37. Exact-head Infrastructure CI 33061987639 succeeded on the control anchor.",
      "provenance": [
        {"kind": "issue", "reference": "Dsamofalov/hwm-control#73"},
        {"kind": "commit", "reference": "control recovery anchor", "repo": "Dsamofalov/hwm-control", "sha": "994730d637d4e4c7c4eb492b22c49993e971d1e4"},
        {"kind": "commit", "reference": "lab recovery anchor", "repo": "Dsamofalov/hwm-lab", "sha": "1595b39b4684143bc34cb5d157eabf1ad4d86c37"},
        {"kind": "ci_run", "reference": "Infrastructure CI 33061987639 success"}
      ]
    },
    {
      "statement": "hwm-lab Publisher Ordinary CI 32947264396 failed on exact source-v3 head 1595b39b4684143bc34cb5d157eabf1ad4d86c37 only because _exact_python() raised AssertionError that exact CPython 3.12.10 is unavailable on the GitHub-hosted runner; the runner image was ubuntu-24.04 20260816.277.1.",
      "provenance": [
        {"kind": "ci_run", "reference": "Publisher Ordinary CI 32947264396 failure and job log"},
        {"kind": "commit", "reference": "failed source-v3 head", "repo": "Dsamofalov/hwm-lab", "sha": "1595b39b4684143bc34cb5d157eabf1ad4d86c37"}
      ]
    },
    {
      "statement": "INFRA_SPEC sections 10.1/10.2 and ADR 0001 authorize a narrow ordinary task-branch publisher and one completed publisher self-installation bootstrap, while explicitly preserving protected-path denial and prohibiting recurring generic source mutation. hwm-lab publisher policy rejects .github/workflows/**, .github/actions/**, CODEOWNERS and publisher-owned paths.",
      "provenance": [
        {"kind": "public_ref", "reference": "docs/INFRA_SPEC.md sections 10.1 and 10.2 at protected base"},
        {"kind": "public_ref", "reference": "docs/ADR/0001-controlled-task-branch-publisher-bootstrap.md at protected base"},
        {"kind": "public_ref", "reference": "hwm-lab control/publisher_policy.py and control/publisher_manifest.bootstrap-v1.json at e37ea628d9c793d5e87bc8b903a9b85b4371991c"}
      ]
    },
    {
      "statement": "hwm-lab ruleset 20817493 is active on the default branch, requires a PR, strict bootstrap status from integration 15368, review-thread resolution, and has no bypass actors. hwm-control ruleset 20817498 has the same strict bootstrap/no-bypass protected-main model.",
      "provenance": [
        {"kind": "public_ref", "reference": "hwm-lab ruleset 20817493"},
        {"kind": "public_ref", "reference": "hwm-control ruleset 20817498"}
      ]
    },
    {
      "statement": "No open PR exists in hwm-control or hwm-lab for #73 or #85, and preflight found no existing equivalent protected-path installer Issue, contract marker, or implementation path. New DAG nodes are #86 P0A and #87 P0B; #85 is now blocked on #87 and remains unclaimed.",
      "provenance": [
        {"kind": "issue", "reference": "Dsamofalov/hwm-control#86"},
        {"kind": "issue", "reference": "Dsamofalov/hwm-control#87"},
        {"kind": "issue", "reference": "Dsamofalov/hwm-control#85"}
      ]
    },
    {
      "statement": "I10-0086 is claimed on the sole branch agent/infra-0086-protected-path-install-contract created strictly from exact protected hwm-control/main bc8a05f6c728d15e32048e5737d9703cd768b731. The claim projection intentionally carries both active ownership facts I10-0073 and I10-0086 without changing the closed core schema map or product checkpoint.",
      "provenance": [
        {"kind": "issue", "reference": "Dsamofalov/hwm-control#86"},
        {"kind": "commit", "reference": "protected branch base", "repo": "Dsamofalov/hwm-control", "sha": "bc8a05f6c728d15e32048e5737d9703cd768b731"}
      ]
    }
  ],
  "decisions": [
    {
      "decision": "Introduce a distinct protected-path installer primitive rather than widen hwm-publish-request/bootstrap-v1 or the ordinary publisher authority.",
      "rationale": "The required .github installation authority is privileged and recurrent, while the existing ordinary publisher is intentionally fail-closed on protected/self-modifying paths."
    },
    {
      "decision": "Keep P0A architecture-only in hwm-control and defer installer implementation/live acceptance to blocked P0B #87.",
      "rationale": "Separating contract authorization from privileged installation preserves the architecture barrier and prevents #85 from claiming before transport exists."
    }
  ],
  "rejected_alternatives": [
    {"alternative": "Widen the ordinary hwm-lab publisher to accept .github paths.", "reason": "That collapses distinct trust boundaries and violates the existing bootstrap-v1 protected-path contract."},
    {"alternative": "Reuse the completed #79 one-time publisher bootstrap exception.", "reason": "INFRA_SPEC limits that exception to the one-time ordinary publisher self-installation and explicitly denies recurring generic mutation."},
    {"alternative": "Use generic connector create_file/update_file/create_commit, direct push, or force reset.", "reason": "P0A source transport and future protected installation are explicitly controlled and fail-closed; generic writers are not authorized continuation paths."}
  ],
  "changed_components": [
    "BUILD_STATUS.json",
    "knowledge-deltas/I10-0086.json"
  ],
  "tests": [
    {"name": "Claim-state Infrastructure CI", "status": "not_run", "reference": "Pending controlled publisher exact-head dispatch"}
  ],
  "evidence": [
    {"kind": "issue", "reference": "Dsamofalov/hwm-control#86"},
    {"kind": "issue", "reference": "Dsamofalov/hwm-control#87"},
    {"kind": "issue", "reference": "Dsamofalov/hwm-control#85"},
    {"kind": "issue", "reference": "Dsamofalov/hwm-control#73"},
    {"kind": "ci_run", "reference": "hwm-lab Publisher Ordinary CI 32947264396"},
    {"kind": "ci_run", "reference": "hwm-control Infrastructure CI 33061987639"}
  ],
  "followups": [
    "Publish the protected-path install request/result schemas, ADR 0009, INFRA_SPEC amendment and focused tests through the existing hwm-control controlled publisher; then complete protected P0A lifecycle."
  ],
  "unresolved": [
    "Architecture source publication, source exact-head CI, completion bookkeeping, protected PR/merge/post-merge evidence and terminal DAG reconciliation remain pending."
  ]
}
