{"schema":"hwm-knowledge-delta/v1","task_id":54,"goal":"Materialize the missing protected deterministic hwm-project-state/v2 snapshot required by the merged I09 task-context compiler without changing I03 or I09 semantics.","verified_facts":[{"statement":"Issue #54 was claimed from protected hwm-control main 9e5e892dd4c5e3100a66472b3b30832ca60abdc5 on the sole ownership branch agent/infra-0054-project-state-snapshot; claim bookkeeping commit is e0c302d32d4b53938ccf7ea9d4db57accf7daae8.","provenance":[{"kind":"issue","reference":"Dsamofalov/hwm-control#54"},{"kind":"commit","reference":"I09-0054 protected claim base","repo":"Dsamofalov/hwm-control","sha":"9e5e892dd4c5e3100a66472b3b30832ca60abdc5"},{"kind":"commit","reference":"I09-0054 claim bookkeeping commit","repo":"Dsamofalov/hwm-control","sha":"e0c302d32d4b53938ccf7ea9d4db57accf7daae8"}]},{"statement":"The canonical production path is state/current.json, matching INFRA_SPEC Phase 2, and exact bytes are a schema-valid existing-I03 reducer output with Git blob SHA-1 9319d500cc5f5532c5fb386e204cec3f2f197e6b and SHA-256 2e08e92d16e350627b7801a0b97bf3f8c1737a04b1aef19b28f863711e92e9d7.","provenance":[{"kind":"public_ref","reference":"docs/INFRA_SPEC.md Phase 2 deterministic state deliverable state/current.json"},{"kind":"commit","reference":"project-state materialization commit","repo":"Dsamofalov/hwm-control","sha":"2a204c28bb04cdc4e1b8a3891d40ebeef93b9cc9"},{"kind":"public_ref","reference":"state/current.json blob 9319d500cc5f5532c5fb386e204cec3f2f197e6b; SHA-256 2e08e92d16e350627b7801a0b97bf3f8c1737a04b1aef19b28f863711e92e9d7"}]},{"statement":"Exact product current HEAD is 8fd669336b36064e842252d69fb4016cc526a9d4; the latest exact Core and Full checkpoint evidence independently binds that same SHA to workflow run 31727700552 and check suite 86074732000, with Core check/status 94546993956/52198023145 and Full check/status 94546273227/52197856764.","provenance":[{"kind":"commit","reference":"exact product refs/heads/main","repo":"Dsamofalov/hwm_predictor","sha":"8fd669336b36064e842252d69fb4016cc526a9d4"},{"kind":"ci_run","reference":"CI 31727700552 Core check 94546993956 status 52198023145","repo":"Dsamofalov/hwm_predictor","sha":"8fd669336b36064e842252d69fb4016cc526a9d4"},{"kind":"ci_run","reference":"CI 31727700552 Full check 94546273227 status 52197856764","repo":"Dsamofalov/hwm_predictor","sha":"8fd669336b36064e842252d69fb4016cc526a9d4"}]},{"statement":"At the snapshot boundary the complete open I04 lifecycle projection is ready=[], claimed=[54], blocked=[48,49,50]. No authoritative I03 inputs exist for post-merge checkpoint, live-evidence checkpoint, knowledge health, or graph health, so those domains are explicit unknown rather than guessed from Product HEAD, Core/Full, I08 ledger, or future I10 state.","provenance":[{"kind":"issue","reference":"Dsamofalov/hwm-control open Issues #48,#49,#50,#54 observed after #54 claim"},{"kind":"public_ref","reference":"control/state_reducer.py and I03 consistency tests preserve explicit unknown/error and prohibit fallback"}]}],"decisions":[{"decision":"Materialize exactly state/current.json as canonical UTF-8 JSON with lexicographically sorted object keys, compact separators, no BOM, and exactly one trailing LF.","rationale":"INFRA_SPEC Phase 2 names state/current.json, and a deterministic byte profile gives the existing I09 exact blob/SHA-256 binding a stable production source without changing the project-state schema."},{"decision":"Use only existing I03 reducer inputs and preserve unavailable domains as explicit unknown.","rationale":"The reducer and consistency tests forbid guessed SHA/fallback semantics; no I09 freshness rule should be weakened to manufacture a source artifact."},{"decision":"Add a narrow materialization consistency test that regenerates the committed snapshot through the existing reducer and compares exact canonical bytes.","rationale":"This proves schema validity and deterministic materialization in Infrastructure CI without modifying reducer, schema, compiler, publisher, product, or context semantics."}],"rejected_alternatives":[{"alternative":"Use a fixture, synthetic state, task-branch-only artifact, or project-state from another commit for Issue #48.","reason":"The merged I09 compiler requires exact Git blob identity at a project-state commit equal to observed protected hwm-control main."},{"alternative":"Guess post-merge/live/knowledge/graph values from Product HEAD, Core/Full, historical ledger, or future milestones.","reason":"Existing I03 lifecycle semantics require unknown when authoritative evidence is unavailable and prohibit substitution."},{"alternative":"Change project-state schema, reducer semantics, I09 compiler freshness, or publisher boundaries to accept the missing source.","reason":"The blocker is materialization, not a contract defect; widening authority would violate Issue #54 scope."}],"changed_components":["BUILD_STATUS.json","knowledge-deltas/I09-0054.json","state/current.json","tests/test_materialized_project_state.py"],"tests":[{"name":"Canonical project-state byte/hash construction and Git blob identity verification","status":"pass","reference":"2349 bytes; blob 9319d500cc5f5532c5fb386e204cec3f2f197e6b; SHA-256 2e08e92d16e350627b7801a0b97bf3f8c1737a04b1aef19b28f863711e92e9d7"},{"name":"Materialized snapshot exact existing-reducer regeneration test","status":"pass","reference":"tests/test_materialized_project_state.py; enforced by Infrastructure CI on PR head"}],"evidence":[{"kind":"issue","reference":"Dsamofalov/hwm-control#54"},{"kind":"commit","reference":"claim bookkeeping","repo":"Dsamofalov/hwm-control","sha":"e0c302d32d4b53938ccf7ea9d4db57accf7daae8"},{"kind":"commit","reference":"state/current.json materialization","repo":"Dsamofalov/hwm-control","sha":"2a204c28bb04cdc4e1b8a3891d40ebeef93b9cc9"},{"kind":"public_ref","reference":"state/current.json blob 9319d500cc5f5532c5fb386e204cec3f2f197e6b and SHA-256 2e08e92d16e350627b7801a0b97bf3f8c1737a04b1aef19b28f863711e92e9d7"}],"followups":["After protected merge, exact post-merge Infrastructure CI and protected-main byte verification, close Issue #54 completed and move Issue #48 blocked to ready only if #54 remains its sole blocker. Do not claim Issue #48 in this dialogue."],"unresolved":[]}