{
  "schema": "hwm-knowledge-delta/v1",
  "task_id": 37,
  "goal": "Define and implement the smallest trusted repository-local hwm-context publisher for deterministic historical-ledger bytes without broadening bootstrap-v1 or introducing long-lived credentials.",
  "verified_facts": [
    {
      "statement": "Protected hwm-control main at claim time was exact 1b60570d70bfc84c216a5ab8c59ecd805078695b; Issue #35 was completed and Issue #37 was ready while Issue #38 was blocked on #37.",
      "provenance": [{"kind": "commit", "reference": "protected hwm-control main at I08-0037 claim", "repo": "Dsamofalov/hwm-control", "sha": "1b60570d70bfc84c216a5ab8c59ecd805078695b"}, {"kind": "issue", "reference": "Dsamofalov/hwm-control#37"}]
    },
    {
      "statement": "Protected hwm-context main at architecture decision time was exact 806f555efa805d3b17310763dc41ccf65696f961, claims/ contained only .gitkeep, and active ruleset 20817497 required PR, strict bootstrap, and review-thread resolution with no bypass actor.",
      "provenance": [{"kind": "commit", "reference": "protected hwm-context main / claims skeleton", "repo": "Dsamofalov/hwm-context", "sha": "806f555efa805d3b17310763dc41ccf65696f961"}, {"kind": "public_ref", "reference": "Dsamofalov/hwm-context ruleset 20817497"}]
    }
  ],
  "decisions": [
    {"decision": "Use distinct hwm-historical-ledger-publish-request/v1 and hwm-historical-ledger-publish-result/v1 contracts.", "rationale": "The historical-ledger trust domain targets a different repository and protected PR/CI lifecycle; bootstrap-v1 remains forward-stable and hwm-control-only."},
    {"decision": "Run the privileged publisher repository-locally in hwm-context with only its short-lived job-scoped built-in GITHUB_TOKEN.", "rationale": "This token is sufficient for scoped contents/PR/issues/actions operations in its own repository and avoids PATs, deploy keys, long-lived secrets, and invalid cross-repository use of the hwm-control token."},
    {"decision": "Bind transport to hwm-context Issue #2 and exact owner account id/login; permit exactly the two canonical claims outputs as regular add/replace blobs with expected protected-base CAS.", "rationale": "A narrow durable Issue-comment ingress, path allowlist, immutable blob identity, and exact base make the privileged mutation surface deterministic and fail closed."},
    {"decision": "Explicitly dispatch repository-bootstrap-ci.yml and bind the returned run to the exact candidate head.", "rationale": "PRs created by GITHUB_TOKEN cannot safely rely on recursive PR-event workflow triggering."},
    {"decision": "Retain claims/.gitkeep in v1 and add no file-delete primitive.", "rationale": "The placeholder does not conflict with canonical outputs, so deletion capability is unnecessary."}
  ],
  "rejected_alternatives": [
    {"alternative": "Expand hwm-publish-request/bootstrap-v1 or its hwm-control repository allowlist.", "reason": "That would retroactively broaden a merged credential/repository trust boundary."},
    {"alternative": "Use PAT, deploy key, or other long-lived cross-repository secret.", "reason": "Repository-local built-in GITHUB_TOKEN is sufficient and more narrowly scoped."},
    {"alternative": "Direct push generated claims to hwm-context/main.", "reason": "The active ruleset requires protected PR + strict bootstrap and the publisher contract forbids protected-main ref updates."},
    {"alternative": "Checkout or execute candidate/generated bytes in the privileged job.", "reason": "Generated ledger bytes are inert untrusted data; only bounded validation and Git object linking are permitted."}
  ],
  "changed_components": [
    "schemas/historical-ledger-publish-request.v1.schema.json",
    "schemas/historical-ledger-publish-result.v1.schema.json",
    "control/context_ledger_publisher_contract.py",
    "docs/ADR/0002-hwm-context-historical-ledger-publisher.md",
    "tests/test_context_ledger_publisher_contract.py",
    "knowledge-deltas/I08-0037.json",
    "BUILD_STATUS.json"
  ],
  "tests": [
    {"name": "python -m unittest tests.test_context_ledger_publisher_contract -v", "status": "pass", "reference": "local contract preflight before controlled source publication"}
  ],
  "evidence": [
    {"kind": "issue", "reference": "Dsamofalov/hwm-control#37"},
    {"kind": "issue", "reference": "Dsamofalov/hwm-context#2"}
  ],
  "followups": [
    "Install the repository-local publisher through a separate protected hwm-context PR and prove the live sandbox acceptance matrix without merging generated ledger bytes.",
    "Only after I08-0037 completes may Issue #38 transition blocked to ready; do not claim or start its importer in this task."
  ],
  "unresolved": []
}
