{"schema":"hwm-knowledge-delta/v1","task_id":45,"goal":"Define the forward-only deterministic I09 task-context request and canonical pack serialization barrier without implementing a compiler, publisher, LLM path, wiki synthesis, Graphify, or product changes.","verified_facts":[{"statement":"I09-P0 started from protected hwm-control main 8921009f64c5d9b0591de4bf4ccb9038af78cd33 and read-only hwm-context main fec8bc674952c2d9d950bf76d293d596e89dc7c1; completed dependency Issue #38 was already closed completed.","provenance":[{"kind":"commit","reference":"I09-P0 exact hwm-control claim base","repo":"Dsamofalov/hwm-control","sha":"8921009f64c5d9b0591de4bf4ccb9038af78cd33"},{"kind":"commit","reference":"I09-P0 exact hwm-context architecture/security reference","repo":"Dsamofalov/hwm-context","sha":"fec8bc674952c2d9d950bf76d293d596e89dc7c1"},{"kind":"issue","reference":"Dsamofalov/hwm-control#38 completed prerequisite"}]},{"statement":"Existing hwm-context strict historical-ledger publication remains narrowly scoped to the two claims paths and protected by active strict bootstrap ruleset 20817497; I09-P0 does not widen or copy that T1 surface.","provenance":[{"kind":"commit","reference":"historical publisher/security reference","repo":"Dsamofalov/hwm-context","sha":"fec8bc674952c2d9d950bf76d293d596e89dc7c1"},{"kind":"public_ref","reference":"Dsamofalov/hwm-context ruleset 20817497"}]},{"statement":"All pre-I09 versioned schema bytes are pinned by exact Git blob identities in the new contract test so an I09-P0 change cannot silently rewrite existing contracts.","provenance":[{"kind":"commit","reference":"pre-I09 schema baseline","repo":"Dsamofalov/hwm-control","sha":"8921009f64c5d9b0591de4bf4ccb9038af78cd33"}]}],"decisions":[{"decision":"Introduce separate `hwm-task-context-request/v1` and `hwm-task-context-pack/v1` closed schemas.","rationale":"I09 needs a forward-only serialization barrier without retroactively widening job/result, publisher, historical, claim, or project-state contracts."},{"decision":"Make `context.json` the only v1 task-context artifact and leave `context.md` undefined in v1.","rationale":"A second serialized projection would require its own deterministic byte contract; omitting it keeps one canonical machine read model and avoids accidental authority duplication."},{"decision":"Bind request identity to SHA-256 of canonical request JSON and bind Issue/state/ledger/KD/product inputs to exact digests/commits/blobs.","rationale":"Exact provenance plus digest identity prevents implicit current-HEAD substitution and makes rebuilds byte-reproducible."},{"decision":"Use deterministic stable ranking, authority-preserving deduplication, and UTF-8 content-byte budgets with longest-valid-prefix truncation.","rationale":"These rules are reproducible without LLM ranking, token-estimator drift, enumeration order, wall clock, or environment entropy."},{"decision":"Accept a pack only with fresh exact-equality proofs for mandatory current bindings; stale/mismatched mandatory sources fail before pack creation.","rationale":"A derived context read model must not normalize or guess authoritative current state."}],"rejected_alternatives":[{"alternative":"Extend `hwm-job/v1` build_task_context parameters into the I09 request contract.","reason":"That would retroactively widen a merged versioned contract rather than introduce the required forward-only serialization barrier."},{"alternative":"Retain a v1 `context.md` projection without a separate byte-level contract.","reason":"Markdown would create a second ambiguous serialized read model; v1 keeps only canonical context.json."},{"alternative":"Use LLM semantic ranking/deduplication or token budgets.","reason":"Phase 7 requires deterministic retrieval first; model/tokenizer behavior is not a deterministic authority input."},{"alternative":"Deduplicate identical bytes across authority classes.","reason":"That could collapse historical evidence into current-state-looking content and lose authority provenance."},{"alternative":"Generalize the existing hwm-context historical-ledger publisher or strict gate for task packs.","reason":"Task-pack publication belongs to Issue #47 and the existing T1 historical surface must remain narrow."}],"changed_components":["BUILD_STATUS.json","docs/I09_TASK_CONTEXT_CONTRACT.md","schemas/task-context-request.v1.schema.json","schemas/task-context-pack.v1.schema.json","tests/contracts/task_context_contract_core.py","tests/contracts/task_context_vectors.py","tests/contracts/test_task_context_contracts.py","knowledge-deltas/I09-0045.json"],"tests":[{"name":"I09-P0 deterministic task-context contract vectors","status":"not_run","reference":"exact-head Infrastructure CI pending first controlled publication"},{"name":"full repository Infrastructure CI regression suite","status":"not_run","reference":"exact-head Infrastructure CI pending first controlled publication"}],"evidence":[{"kind":"issue","reference":"Dsamofalov/hwm-control#45 claimed on agent/infra-0045-task-context-contracts"},{"kind":"commit","reference":"exact protected claim base","repo":"Dsamofalov/hwm-control","sha":"8921009f64c5d9b0591de4bf4ccb9038af78cd33"},{"kind":"commit","reference":"read-only historical publisher/security reference","repo":"Dsamofalov/hwm-context","sha":"fec8bc674952c2d9d950bf76d293d596e89dc7c1"}],"followups":["Issue #46 may implement deterministic compiler behavior only after this contract is merged.","Issue #47 may define/implement task-pack publication only after this contract is merged."],"unresolved":[]}
